{"action_id":"synthetic-action","artifact_type":"cockpit-action-receipt","diagnostics":["Synthetic wire fixture, no client data or native rendering"],"finished_at":"2026-10-08T00:00:01Z","input_fingerprint":"79f0a7f0e9e333178221c519cacfec8c78fa2b6b45121668c19ab75be87f36ad","operation":"render-report","outcome":"succeeded","outputs":[{"path":"cockpit/reports/synthetic-action/report-1.md","sha256":"0ea5c121469865f5d5cae8ccecaafde7b551aa54d040c3d0734333b7c0c5a0e8","size":16}],"policy_fingerprint":"30d003aa426b81ee162b9461cf96fba2c04909b23325de2122057c2e0c8b1ec6","run_id":"synthetic-run","schema_version":"1.0.0","started_at":"2026-10-08T00:00:00Z"}
